name,category,website,address,city,geometry,info
7. JUNI: Utendørs bruktmarked,events,https://fb.me/e/34XsP5m2x,"Rødbanken, Storgata 66",9008 Tromsø,"69.6491423,18.9556428",i regi FIVH Nord
Bardus Bistro (kortreist mat),food,https://www.bardus.no/,Cora Sandels gate 4,9008 Tromsø,"18.95558,69.65055",
BaseCamp Tromsø (ski- og sykkelreparatør),sports,https://www.facebook.com/basecamptromso/,Mellomvegen 16,9007 Tromsø,"18.9486,69.64704",
Bike Kitchen,bike,https://www.facebook.com/profile.php?id=100068874124114,Strandvegen 50,9007 Tromsø,"18.94056,69.64099",
Clas Ohlson verktøyutlån Jekta,tools,https://www.uteleiehosclas.no/,Stovner Senter 3,9015 Tromsø,"18.92072,69.67437",
Tromsø Folkeverksted (regi Framtiden i våre hender),tools,https://www.framtidennord.no/,Samuel Arnesens gate 5,9008 Tromsø,"18.960290,69.647336",
Edel Antikk og Vintage,clothes,,Storgata 62,9008 Tromsø,"18.95500,69.64905",
Elesco (hvitevarereparatør),tools,http://www.elesco.no/,Sjølundvegen 7,9016 Tromsø,"18.913333,69.666493",
Gjenbruken Tromsø (NLM Second Hand),clothes,https://gjenbruken.no/tromso/,Strandgata 5,9008 Tromsø,"18.95318,69.64613","Vi driver gjenbruksbutikken Gjenbruken (eller NLM Gjenbruk som det fortsatt står på skiltet) i Strandgata 5.
Alle jobber frivillig, og overskuddet går til Misjonssambandet som bl.a. driver mange prosjekter i Afrika, Asia og Sør-Amerika. Les om prosjektene på skolehelsevann.no
Våre største varegrupper er klær og andre tekstiler, kjøkkenutstyr og nips, men det er også mye annet spennende å finne. 
Gjenbruken skaper bærekraft både lokalt og globalt."
Gullsmed Kristiansen AS,tools,,Kirkegata 14,9008 Tromsø,"18.95536,69.64851",
Bondens Marked Tromsø,clothes," https://www.facebook.com/BondensmarkedArktis, https://bondensmarked.no/",Stortorget,9008 Tromsø,"18.95914,69.65135",
Miljøloftet (kontor Framtiden i Våre Hender Nord),tools,https://www.framtidennord.no/,Storgata 88,9008 Tromsø,"18.956983,69.650837",
Mobit Stakkevollvegen - Tromsø (mobil/data reparasjon),clothes,https://www.facebook.com/mobitStakkevollvegen/,Stakkevollvegen 96,9010 Tromsø,"18.96897,69.66717",
More food options to come,food,Stay tuned,Tromsø,Tromsø,"18.94782,69.67012",
OmMøblert,clothes,http://www.ommoblert.no/,"Skippergata 35-39, Inngang fra, Otto Sverdrups gate",9008 Tromsø,"18.96485,69.65589",
Perfekt Renseri AS,clothes,Perfekt Renseri AS,Grønnegata 99,9008 Tromsø,"18.95748,69.65264",
Postludium - bruktbutikk,clothes,https://kirkensbymisjon.no/gjenbruksbutikken-postludium/,Skippergata 4 A,9008 Tromsø,"18.96034,69.65279",gjør diverse syjobber som reparasjon
fint,food,https://www.kafe.pust.io/,Skippergata 1C,9008 Tromsø,"18.96051,69.65217",
Rebell Remiks Bærekraftssenter,clothes,,"Kvaløyvegen 329, 9016 Tromsø",,,"Vi har varemottak for salgbare varer som noen kan se nytte i. 
Du kan også finne møbler til hybelen eller leiligheten til en billig penge. 
Vi tilbyr gratis henting av møbler som er salgbare, og i kan også levere avfall til returstasjonen for en billig penge.


Utover hsøste vil det bli arrangert både sykurs, malekurs i vårt verksted. 
Det jobbes med tilbud om å låne/leie symaskin og enkle verktøy for små reparasjoner. 
Våre egne,  store Pent:Brukt-markeder er kjempepopulære og arrangeres med jevne mellomrom.
Det står mye på agendaen utover høsten, og som vi jobber med å iversette. 
Og hver lørdag har vi kafe med hyggelige priser. Det er lokale idrettslag og foreninger som driver kafeen, og får h"
REKO-Ringen (direktehandel fra bonden,food,https://www.facebook.com/groups/rekotromso/,Breiviklia 2,9019 Tromsø,"18.981207,69.678623","pop-up sjekk Facebook), parkeringsplass utenfor Breivikahallen"
Remiks Bruktbutikk / Bli Rebell,clothes,https://www.blirebell.no/,Kvaløyvegen 329,9016 Tromsø,"18.92001,69.66931",
Steget Videre skomakeri,tools,"https://www.stegetvidere.no, https://www.facebook.com/stegetvidereskomakeri, https://www.instagram.com/stegetvidere_skomakeri ","Torgcenteret 1.etg, Storgata 81, 9008 Tromsø",,,"OMSÅLING
REPARASJONER
GLIDELÅS
GROVSØM"
Steget Videre Skomakeri,tools,https://stegetvidere.no/,Storgata 81,9008 Tromsø,"18.95832,69.65071",
Svermeri Kafé og Redesign,clothes,https://www.facebook.com/svermeri,Skippergata 2,9008 Tromsø,"18.95986,69.65281",
Tromsø Bruktbokhandel,clothes,https://www.facebook.com/Troms%C3%B8-Bruktbokhandel-478411402273244/,Kirkegata 6 (til venstre bak City to Summit),9008 Tromsø,"18.95644,69.64827",
Tromsø Frimerke & Mynt,clothes,,Storgata 81B,9008 Tromsø,"18.95769,69.65078",
Tromsø Husflidslag,clothes,https://husflid.no/lag/troms-regionhusflidslag/tromso-husflidslag/,,,,Kurs i diverse
Tromsø Outdoor (utleie),clothes,http://www.tromsooutdoor.no/,Fredrik Langes gate 14,9008 Tromsø,"18.95797,69.64926",
Tromsø Ski og Sykkel (service or reparasjon),sports,https://www.tromsoskiogsykkel.no/,Ærfuglvegen 3B,9015 Tromsø,"18.93028,69.67523",
Tromsø Skomakerverksted,tools,http://tromsoskomakerverksted.no/,Strandgata 34,9008 Tromsø,"18.95600, 69.64804","Vårt dyktige team av skomakere har lang erfaring innen skoreparasjon. Vi kan fikse alt fra såler og hæler til sømmer og glidelåser, slik at du kan bruke favorittskoene dine lenger."
Tromsø Skomakerverksted,tools,http://tromsoskomakerverksted.no/,Strandgata 34,9008 Tromsø,"18.95600,69.64804",
TURBO utlån av sportsutstyr,sports,https://www.facebook.com/TromsoTurutstyr,Grønnegata 94,9008 Tromsø,"18.95549,69.65092",
UFF Second Hand Tromsø,clothes,http://uffnorge.org/,Storgata 41,9008 Tromsø,"18.95335,69.64714",
Øivind Holmboe Guitarworks,clothes,http://www.guitarworks.no/,M Urdals veg 6,9011 Tromsø,"18.94568,69.65826",
HappyCow - vegetar/vegan matguide,food,https://www.happycow.net/europe/norway/tromsoe/,internettet,,"69.64623, 18.97028",Matguide hvor du finner du vegetariske og veganske alternativer i hele verden med brukeranmeldelelser og bilder. Finnes som app og nettside.
SJØMATGUIDEN – VELG MILJØVENNLIG SJØMAT,food,https://www.wwf.no/sjømatguiden,internettet,,"69.64420, 18.96391","Bruk denne sjømatguiden når du handler fisk i butikk. Mange fiskemetoder på mange typer matfisk er rødt lys (truet fiskebestand, miljøfiendtlig). Se iallefall etter MSC eller FSC sertifiseringsmerkene når du handler fisk."
Tromsøskapere - MAKERSPACE,tools,https://www.tromsoskapere.no/skogstua,Skogstua i Lærerskolevegen 8,9006 Tromsø,"69.63568, 18.92432","Skogstua fellesverksted er et sted for gjester og medlemmer som ønsker å holde på med skapende aktiviteter, det være seg håndverk, kreative eller teknologiske uttrykk. Medlemmer som ønsker å ha tilgang til lokalene 24/7 kan få dette ved å kjøpe tilgang på medlemssiden hos smartorg.no. Ikke medlem? Meld deg inn her.

Skogstua skal også brukes til kurs, aktiviteter, prosjekter og samarbeid med andre miljø.
Velkommen til vårt nye fellesverksted!"
TORSDAGER: Fiksekveld på Tromsø folkeverksted kl 18-20:30,events,https://fb.me/e/32jZipQiQ,Adolf Thomsens gate 5,9008 Tromsø,"69.64926, 18.95710","Gratis reparasjons- og hobbyverksted. Fellesskap hvor du får hjelp til å bruke verktøy og utstyr for å reparere og vedlikeholde SKI, SYKKEL, TEKSTIL og en god del mer. Frivillig drevet av FIVH Tromsø som veileder deg med verktøyene og reparasjonene. Men du må oftest reparere og føle på mestringa sjæl."